{
  "schema_version": "v1alpha1",
  "name": "factory",
  "version": "0.1.0",
  "description": "Durable coordinator/worker fan-out app. Exercises scoped actions and delegated child-session authority.",
  "workload": {
    "image": "ghcr.io/mpuig/barista-factory:0.1.0",
    "digest": "sha256:3b1c2d4e5f60718293a4b5c6d7e8f90112233445566778899aabbccddeeff001",
    "architectures": ["aarch64", "x86_64"],
    "entrypoint": ["/app/coordinator"],
    "working_dir": "/work",
    "readiness": {
      "type": "log_line",
      "log_pattern": "coordinator ready",
      "timeout_seconds": 30
    }
  },
  "endpoints": [
    {
      "name": "status",
      "protocol": "http",
      "port": 8080,
      "path": "/status"
    }
  ],
  "capabilities": {
    "optional": [
      { "capability": "session.fork" },
      { "capability": "grants.delegated" },
      { "capability": "capsule.export" }
    ]
  },
  "permissions": {
    "actions": [
      "session.create",
      { "action": "session.get", "scope": "own_session" },
      { "action": "session.get", "scope": "created_sessions" },
      { "action": "session.list", "scope": "created_sessions" },
      { "action": "session.delete", "scope": "created_sessions" },
      { "action": "session.exec", "scope": "created_sessions" },
      { "action": "session.events", "scope": "created_sessions" },
      { "action": "session.fork", "scope": "created_sessions" },
      { "action": "artifact.read", "scope": "own_session" },
      { "action": "artifact.read", "scope": "created_sessions" },
      { "action": "artifact.write", "scope": "own_session" }
    ],
    "network": {
      "egress": "allowlist",
      "allow": ["ntfy.sh:443"]
    },
    "secrets": [
      { "name": "BARISTA_HOST_API_TOKEN", "ref": "grant://factory/coordinator" },
      { "name": "NOTIFY_TOKEN", "ref": "secret://factory/notify-token" }
    ],
    "artifacts": { "read": true, "write": true },
    "child_sessions": {
      "max_concurrent": 8,
      "max_total": 64,
      "allow_descendants": false,
      "actions": [
        { "action": "session.exec", "scope": "own_session" },
        { "action": "session.events", "scope": "own_session" },
        { "action": "artifact.write", "scope": "own_session" }
      ]
    },
    "degraded_modes": [
      { "name": "no-capsule-harvest", "without": ["capsule.export"] }
    ]
  },
  "state_transfer": {
    "exact": true
  },
  "metadata": {
    "sh.barista.factory": {
      "worker_template": "factory"
    }
  }
}
